公司品牌簡稱,序號,官方網站,產業,員工人數,email,聯絡人名稱,來源,說明,Unnamed: 9,Day 1,Day 7,Day 14,Day 30,Day 60,day1_title,day1_content,day7_title,day7_content,day14_title,day14_content,day30_title,day30_content,day60_title,day60_content
丞洋,20260429,http://www.shouyo.com.tw,批發,10-29人,lester@shouyo.com.tw,官方,https://www.104.com.tw/company/wf51gvk,擁有30年經驗的精品家電代理商，為荷蘭PRINCESS、美國Excalibur及台灣ARTISAN的總代理與經銷。公司歷經多次轉型，始終保持年輕與學習的心，專注於引進世界一流的小家電產品。透過專業的進口銷售實力，為台灣消費者打造高品質的居家生活舞台。,,2026/4/29,2026/5/6,2026/5/13,2026/5/29,2026/6/28,關於丞洋代理家電品牌的電商體驗建議,您好，<br><br>丞洋在代理荷蘭 PRINCESS 與美國 Excalibur 等精品家電上的成就非常卓越，團隊始終保持年輕的學習心態更是令人佩服。不過我也觀察到，目前網站在呈現這些世界一流小家電的「生活質感」與「直覺購物」上，似乎還有很大的提升空間。<br><br>我們是 PlayPlus，專注於協助精品家電商將「陽春」網站轉化為高質感、高轉換的數位平台。我們曾協助多個品牌在不改動後端邏輯的情況下，大幅提升前端的導購體驗。<br><br>是否方便寄一份我們過去在精品電商領域的優化案例給您參考？您可以從這邊參考我們的服務及作品集：https://playplus.com.tw/<br><br>感謝您,想確認關於丞洋網站的建議,您好，<br><br>上週分享了一些關於丞洋網站在電商體驗優化上的想法，不知您是否有空撥冗閱覽？<br><br>如果您最近正忙於新產品線的代理，我完全能理解。若您對如何透過 UI/UX 提升轉換率有興趣，隨時歡迎回信。<br><br>您可以從這邊參考我們的服務及作品集：https://playplus.com.tw/<br><br>感謝您,精品家電品牌的數位實戰分享,您好，<br><br>我想補充一個案例。我們曾協助一家家電代理商優化其購物車流程與手機端視覺，讓其移動端轉換率提升了 42%。<br><br>對於丞洋這樣擁有多個國際品牌的公司，精簡且具設計感的導購流程能大幅提升消費者的信任與客單價。期待有機會與您分享更多實戰細節。<br><br>您可以從這邊參考我們的服務及作品集：https://playplus.com.tw/<br><br>感謝您,關於電商優化的執行彈性,您好，<br><br>這段時間沒收到您的回音，我猜測您可能在考量網站優化是否會影響現有的金流或庫存系統？<br><br>PlayPlus 擅長純前端優化，能確保在不影響後端系統穩定的前提下，讓消費者感受到全新的視覺與操作。我們的主管協作模式非常輕量，每週僅需 15 分鐘確認方向即可。<br><br>您可以從這邊參考我們的服務及作品集：https://playplus.com.tw/<br><br>感謝您,謝謝丞洋，祝品牌持續成長,您好，<br><br>這是我的最後一封追蹤信。由於未收到您的回覆，我會先將您的資料移出聯繫名單，以免造成困擾。<br><br>由衷敬佩丞洋 30 年來的經營智慧，若未來有任何數位體驗優化或網站改版需求，PlayPlus 隨時歡迎諮詢。<br><br>祝 貴司生意興隆，業績長紅。<br><br>您可以從這邊參考我們的服務及作品集：https://playplus.com.tw/<br><br>感謝您
丞洋,20260429,http://www.shouyo.com.tw,批發,10-29人,service@shouyo.com.tw,官方,https://www.104.com.tw/company/wf51gvk,擁有30年經驗的精品家電代理商，為荷蘭PRINCESS、美國Excalibur及台灣ARTISAN的總代理與經銷。公司歷經多次轉型，始終保持年輕與學習的心，專注於引進世界一流的小家電產品。透過專業的進口銷售實力，為台灣消費者打造高品質的居家生活舞台。,,2026/4/29,2026/5/6,2026/5/13,2026/5/29,2026/6/28,關於丞洋代理家電品牌的電商體驗建議,您好，<br><br>丞洋在代理荷蘭 PRINCESS 與美國 Excalibur 等精品家電上的成就非常卓越，團隊始終保持年輕的學習心態更是令人佩服。不過我也觀察到，目前網站在呈現這些世界一流小家電的「生活質感」與「直覺購物」上，似乎還有很大的提升空間。<br><br>我們是 PlayPlus，專注於協助精品家電商將「陽春」網站轉化為高質感、高轉換的數位平台。我們曾協助多個品牌在不改動後端邏輯的情況下，大幅提升前端的導購體驗。<br><br>是否方便寄一份我們過去在精品電商領域的優化案例給您參考？您可以從這邊參考我們的服務及作品集：https://playplus.com.tw/<br><br>感謝您,想確認關於丞洋網站的建議,您好，<br><br>上週分享了一些關於丞洋網站在電商體驗優化上的想法，不知您是否有空撥冗閱覽？<br><br>如果您最近正忙於新產品線的代理，我完全能理解。若您對如何透過 UI/UX 提升轉換率有興趣，隨時歡迎回信。<br><br>您可以從這邊參考我們的服務及作品集：https://playplus.com.tw/<br><br>感謝您,精品家電品牌的數位實戰分享,您好，<br><br>我想補充一個案例。我們曾協助一家家電代理商優化其購物車流程與手機端視覺，讓其移動端轉換率提升了 42%。<br><br>對於丞洋這樣擁有多個國際品牌的公司，精簡且具設計感的導購流程能大幅提升消費者的信任與客單價。期待有機會與您分享更多實戰細節。<br><br>您可以從這邊參考我們的服務及作品集：https://playplus.com.tw/<br><br>感謝您,關於電商優化的執行彈性,您好，<br><br>這段時間沒收到您的回音，我猜測您可能在考量網站優化是否會影響現有的金流或庫存系統？<br><br>PlayPlus 擅長純前端優化，能確保在不影響後端系統穩定的前提下，讓消費者感受到全新的視覺與操作。我們的主管協作模式非常輕量，每週僅需 15 分鐘確認方向即可。<br><br>您可以從這邊參考我們的服務及作品集：https://playplus.com.tw/<br><br>感謝您,謝謝丞洋，祝品牌持續成長,您好，<br><br>這是我的最後一封追蹤信。由於未收到您的回覆，我會先將您的資料移出聯繫名單，以免造成困擾。<br><br>由衷敬佩丞洋 30 年來的經營智慧，若未來有任何數位體驗優化或網站改版需求，PlayPlus 隨時歡迎諮詢。<br><br>祝 貴司生意興隆，業績長紅。<br><br>您可以從這邊參考我們的服務及作品集：https://playplus.com.tw/<br><br>感謝您
景崵,20260429,https://www.swansonvitamins.com.tw/,批發,10-29人,service@jy-trend.com,官方,https://www.104.com.tw/company/1a2x6blodn,美國營養補充劑知名品牌Swanson Health Products在台唯一合法授權經銷商。致力於引進符合國際高信賴度的維生素與營養品，推廣正向營養觀念。透過Swanson 50年的品牌實力與CL獨立測試認證，景崵為國人提供高品質、高滿意度且價格平實的健康消費選擇。,,2026/4/29,2026/5/6,2026/5/13,2026/5/29,2026/6/28,關於 Swanson 品牌在台數位形象優化建議,您好，<br><br>景崵作為美國 Swanson 在台唯一合法經銷商，致力於推廣高品質營養品的精神令人感佩。不過，在現今講求專業信任度的保健食品市場中，我也觀察到目前的官網視覺配置與行動端體驗，似乎還能更精準地傳遞 Swanson 50 年的品牌實力與 CL 認證的權威感。<br><br>我們是 PlayPlus，專注於協助健康產業將「資訊密集」的網站轉化為具備高度信任感與流暢導購動線的數位平台。我們擅長透過 UI/UX 設計讓產品特色一目了然。<br><br>是否方便寄一份我們過去在保健與生技產業的優化案例給您參考？您可以從這邊參考我們的服務及作品集：https://playplus.com.tw/<br><br>感謝您,關於 Swanson 網站優化的一個小提醒,您好，<br><br>上週曾致信分享關於景崵網站優化的一些觀察，不曉得您是否看過？<br><br>若您正忙於新產品上市或認證申請，我完全能理解。如果您對如何透過數位介面強化品牌專業度有興趣，隨時歡迎簡短回覆。<br><br>您可以從這邊參考我們的服務及作品集：https://playplus.com.tw/<br><br>感謝您,保健產業的數位信任與轉化案例,您好，<br><br>我想分享一個案例。我們曾協助一家生技品牌優化其產品詳情頁與認證標章的展示方式，讓使用者的停留時間增加了 25%，轉化率也提升了 18%。<br><br>對景崵來說，專業且簡潔的數位語言是建立消費者長期忠誠度的關鍵。期待能與您分享更多實戰細節。<br><br>您可以從這邊參考我們的服務及作品集：https://playplus.com.tw/<br><br>感謝您,網站優化的執行考量與預算彈性,您好，<br><br>這段時間陸續跟您分享了一些想法，我猜測您可能會擔心網站優化需要大動干戈，或投入過多的人力成本？<br><br>PlayPlus 提供模組化優化方案，主管每週只需 15 分鐘確認進度，不需動用您的核心團隊。我們也提供分階段方案，讓您可以根據年度行銷預算靈活調整。<br><br>您可以從這邊參考我們的服務及作品集：https://playplus.com.tw/<br><br>感謝您,謝謝景崵，祝品牌持續領先,您好，<br><br>這是我最後一次主動寫信給您。沒收到您的回覆，我想數位改版或許不是您今年的重點計畫。我會停止追蹤，以免打擾您的工作。<br><br>由衷敬佩景崵在健康產業的堅持，未來若有任何數位體驗優化的需求，隨時歡迎與 PlayPlus 聯繫。<br><br>祝 貴司業績長紅，萬事如意。<br><br>您可以從這邊參考我們的服務及作品集：https://playplus.com.tw/<br><br>感謝您
博潤,20260429,https://www.borun.tw,批發,10-29人,drjie2024@gmail.com,官方,https://www.104.com.tw/company/1a2x6bmve1,2024年深根台灣的新創企業，延續在中國東莞20年的製造經驗，專營「潔博士DR.J」品牌工業及商用洗衣、洗碗設備。致力於將科技融入人性，提供高效能且具生命尊嚴的產品。透過24小時投幣式自助洗衣加盟與一條龍服務，為全球客戶提升生活品質。,,2026/4/29,2026/5/6,2026/5/13,2026/5/29,2026/6/28,關於潔博士 DR.J 品牌的數位加盟形象建議,您好，<br><br>注意到博潤在工業及商用洗衣設備領域的深厚背景，特別是「潔博士 DR.J」品牌的 24 小時自助加盟服務非常具備市場潛力。不過我也觀察到，目前官網在呈現「科技融入人性」與「一站式服務」這些核心優勢時，介面視覺與加盟引導動線還有不少提升空間。<br><br>我們是 PlayPlus，專注於協助製造業與加盟品牌打造具備高信任感且直覺的數位形象。我們能協助您將技術細節轉化為更具吸引力的加盟說服力。<br><br>是否方便寄一份我們過去在加盟品牌與工業設備產業的優化案例給您參考？您可以從這邊參考我們的服務及作品集：https://playplus.com.tw/<br><br>感謝您,關於博潤網站優化的簡短確認,您好，<br><br>上週曾致信分享關於「潔博士」品牌網站優化的一些觀察，不曉得您是否看過？<br><br>若您正忙於全台加盟佈局，我完全能理解。如果您對如何透過數位優化提升潛在加盟商的轉化率有興趣，隨時歡迎簡短回覆。<br><br>您可以從這邊參考我們的服務及作品集：https://playplus.com.tw/<br><br>感謝您,加盟產業的數位信任與轉化案例,您好，<br><br>我想分享一個案例。我們曾協助一個新創加盟品牌優化其商業模式的呈現方式，讓潛在加盟者的諮詢意願提升了 30% 以上。<br><br>對於博潤這樣擁有 20 年製造經驗的公司，高品質的數位門面是吸引優質加盟主最有效的方式。期待能與您分享更多實戰細節。<br><br>您可以從這邊參考我們的服務及作品集：https://playplus.com.tw/<br><br>感謝您,網站優化的執行彈性與疑慮,您好，<br><br>這段時間沒收到您的回音，我猜測您可能在評估網站改版是否會耗費過多的內部管理成本？<br><br>PlayPlus 的專案管理模式非常輕量，主管每週只需 15 分鐘確認視覺方向，不會影響您的日常營運。我們也提供分階段方案，讓您可以根據加盟推廣計畫靈活調整預算。<br><br>您可以從這邊參考我們的服務及作品集：https://playplus.com.tw/<br><br>感謝您,謝謝博潤，祝品牌全台開花,您好，<br><br>這是我的最後一封追蹤信。沒收到回覆，我想數位改版或許不是您目前的重點計畫。我會停止追蹤，以免打擾您的工作。<br><br>由衷敬佩博潤在洗衣設備產業的專業，未來若有任何數位轉型需求，歡迎隨時與我們聯繫。<br><br>祝 貴司生意興隆，加盟大順。<br><br>您可以從這邊參考我們的服務及作品集：https://playplus.com.tw/<br><br>感謝您
傑基興業,20260429,http://www.healthydental.com.tw/,批發,10-29人,jimmy@healthydental.com.tw,官方,https://www.104.com.tw/company/5ovf2fs,創立逾40年的牙科材料領先供應商，代理瑞士Coltene、日本Tokuyama等國際頂尖牙材品牌。服務對象涵蓋台大、榮總等大型醫院及全國牙醫診所。憑藉專業、責任與創新的理念，傑基興業持續引進國外最新治療技術與售後服務，在業界建立極高信賴度。,,2026/4/29,2026/5/6,2026/5/13,2026/5/29,2026/6/28,關於傑基興業在牙材領域的數位形象優化,您好，<br><br>傑基興業深耕牙科材料領域 40 多年，代理 Coltene 等頂尖品牌的實力令人佩服。不過，作為國內指標性的牙材供應商，我也注意到目前網站在呈現「最新治療技術」與「專業售後服務」時，視覺流暢度與搜尋體驗還有提升空間，這對於爭取新一代醫師的信任感尤為關鍵。<br><br>我們是 PlayPlus，專注於協助醫療與生技品牌將專業力轉化為高品質的數位語言。我們能協助您打造一個兼具專業深度與直覺操作的數位服務平台。<br><br>是否方便寄一份我們過去在醫療與生技產業的優化案例給您參考？您可以從這邊參考我們的服務及作品集：https://playplus.com.tw/<br><br>感謝您,關於傑基興業網站優化的一個小提醒,您好，<br><br>上週有分享一些關於傑基網站在醫材專業呈現上的優化想法，不知您是否有空撥冗閱覽？<br><br>如果您最近正忙於國際牙材展或採購案，我完全能理解。若您對如何透過數位優化提升服務效率有興趣，隨時歡迎回信。<br><br>您可以從這邊參考我們的服務及作品集：https://playplus.com.tw/<br><br>感謝您,醫療產業的數位信任轉化案例,您好，<br><br>我想分享一個案例。我們曾協助一家高端醫材供應商重新梳理產品展示邏輯，讓醫師能更快速找到所需的技術規格，這直接提升了其售後服務的滿意度與新客戶的詢問率。<br><br>對傑基來說，高品質的網站不只是門面，更是強化品牌權威感的工具。期待有機會與您分享更多實戰細節。<br><br>您可以從這邊參考我們的服務及作品集：https://playplus.com.tw/<br><br>感謝您,網站優化的執行考量與預算彈性,您好，<br><br>這段時間沒收到您的回音，我猜測您可能在考量網站優化是否會需要大量的工程人力投入？<br><br>PlayPlus 提供一站式的設計與前端開發方案，主管每週只需 15 分鐘確認進度，不需動用您的核心團隊。我們也提供分階段方案，讓您可以根據年度推廣計畫靈活調整。<br><br>您可以從這邊參考我們的服務及作品集：https://playplus.com.tw/<br><br>感謝您,謝謝傑基興業，祝品牌持續領先,您好，<br><br>這是我最後一封主動追蹤的郵件。沒收到回覆，我想數位改版或許不是您目前的優先事項。我會停止追蹤，以免打擾您的工作。<br><br>由衷敬佩傑基興業 40 年來的堅持，未來若有任何數位體驗優化的需求，歡迎隨時與我們聯繫。<br><br>祝 貴司業務順心，持續領航。<br><br>您可以從這邊參考我們的服務及作品集：https://playplus.com.tw/<br><br>感謝您
傑基興業,20260429,http://www.healthydental.com.tw/,批發,10-29人,service@healthydental.com.tw,官方,https://www.104.com.tw/company/5ovf2fs,創立逾40年的牙科材料領先供應商，代理瑞士Coltene、日本Tokuyama等國際頂尖牙材品牌。服務對象涵蓋台大、榮總等大型醫院及全國牙醫診所。憑藉專業、責任與創新的理念，傑基興業持續引進國外最新治療技術與售後服務，在業界建立極高信賴度。,,2026/4/29,2026/5/6,2026/5/13,2026/5/29,2026/6/28,關於傑基興業在牙材領域的數位形象優化,您好，<br><br>傑基興業深耕牙科材料領域 40 多年，代理 Coltene 等頂尖品牌的實力令人佩服。不過，作為國內指標性的牙材供應商，我也注意到目前網站在呈現「最新治療技術」與「專業售後服務」時，視覺流暢度與搜尋體驗還有提升空間，這對於爭取新一代醫師的信任感尤為關鍵。<br><br>我們是 PlayPlus，專注於協助醫療與生技品牌將專業力轉化為高品質的數位語言。我們能協助您打造一個兼具專業深度與直覺操作的數位服務平台。<br><br>是否方便寄一份我們過去在醫療與生技產業的優化案例給您參考？您可以從這邊參考我們的服務及作品集：https://playplus.com.tw/<br><br>感謝您,關於傑基興業網站優化的一個小提醒,您好，<br><br>上週有分享一些關於傑基網站在醫材專業呈現上的優化想法，不知您是否有空撥冗閱覽？<br><br>如果您最近正忙於國際牙材展或採購案，我完全能理解。若您對如何透過數位優化提升服務效率有興趣，隨時歡迎回信。<br><br>您可以從這邊參考我們的服務及作品集：https://playplus.com.tw/<br><br>感謝您,醫療產業的數位信任轉化案例,您好，<br><br>我想分享一個案例。我們曾協助一家高端醫材供應商重新梳理產品展示邏輯，讓醫師能更快速找到所需的技術規格，這直接提升了其售後服務的滿意度與新客戶的詢問率。<br><br>對傑基來說，高品質的網站不只是門面，更是強化品牌權威感的工具。期待有機會與您分享更多實戰細節。<br><br>您可以從這邊參考我們的服務及作品集：https://playplus.com.tw/<br><br>感謝您,網站優化的執行考量與預算彈性,您好，<br><br>這段時間沒收到您的回音，我猜測您可能在考量網站優化是否會需要大量的工程人力投入？<br><br>PlayPlus 提供一站式的設計與前端開發方案，主管每週只需 15 分鐘確認進度，不需動用您的核心團隊。我們也提供分階段方案，讓您可以根據年度推廣計畫靈活調整。<br><br>您可以從這邊參考我們的服務及作品集：https://playplus.com.tw/<br><br>感謝您,謝謝傑基興業，祝品牌持續領先,您好，<br><br>這是我最後一封主動追蹤的郵件。沒收到回覆，我想數位改版或許不是您目前的優先事項。我會停止追蹤，以免打擾您的工作。<br><br>由衷敬佩傑基興業 40 年來的堅持，未來若有任何數位體驗優化的需求，歡迎隨時與我們聯繫。<br><br>祝 貴司業務順心，持續領航。<br><br>您可以從這邊參考我們的服務及作品集：https://playplus.com.tw/<br><br>感謝您
廣德昌台灣,20260429,https://www.krgtw.com/,批發,10-29人,service@krgtw.com,官方,https://www.104.com.tw/company/1a2x6bmxgl,正官庄大中華區原蔘業務的總代理商，肩負發揚全球第一人蔘品牌的使命。公司專注於正官庄原蔘在台灣的營運與銷售，堅持百年蒸熟、乾燥工法及六年根頂級品質。以共創健康永續的經營生態為目標，致力於提升消費者的健康品質與條蔘文化。,,2026/4/29,2026/5/6,2026/5/13,2026/5/29,2026/6/28,關於正官庄原蔘在台數位門面優化建議,您好，<br><br>廣德昌代理正官庄大中華區原蔘業務，肩負推廣百年條蔘文化的使命，這點令人非常敬重。不過我也觀察到，在現今講求高端養生與精品化體驗的市場中，目前的官網在呈現「頂級品質」與「專業條蔘文化」時，視覺質感與行動端體驗似乎還有優化空間。<br><br>我們是 PlayPlus，專注於協助高端傳統品牌進行數位形象升級。我們能協助您將百年的匠心工法轉化為更具現代精品感的數位語言，讓更多年輕高資產族群感受到原蔘的價值。<br><br>是否方便寄一份我們過去在精品與健康產業的優化案例給您參考？您可以從這邊參考我們的服務及作品集：https://playplus.com.tw/<br><br>感謝您,關於廣德昌網站優化的一個小提醒,您好，<br><br>上週曾致信分享關於正官庄原蔘網站在數位形象呈現上的觀察，不曉得您是否看過？<br><br>若您正忙於品牌推廣或進口業務，我完全能理解。如果您對如何透過數位優化提升高端客群的轉化率有興趣，隨時歡迎簡短回覆。<br><br>您可以從這邊參考我們的服務及作品集：https://playplus.com.tw/<br><br>感謝您,精品健康產業的數位視覺轉化案例,您好，<br><br>我想分享一個案例。我們曾協助一個傳統高端品牌重新打造其數位展示區，透過強調「工藝故事」與優化視覺流暢度，讓該品牌的高端系列轉化率提升了 20% 以上。<br><br>對廣德昌來說，高品質的數位門面能更精準地傳遞正官庄原蔘的尊貴感。期待能與您分享更多實戰細節。<br><br>您可以從這邊參考我們的服務及作品集：https://playplus.com.tw/<br><br>感謝您,數位升級的執行疑慮與彈性,您好，<br><br>這段時間陸續跟您分享了一些想法，我猜測您可能會擔心數位形象升級是否會失去傳統品牌的莊重感？<br><br>事實上，PlayPlus 的強項在於平衡「傳統底蘊」與「現代美學」。我們提供輕量化的協作模式，主管每週只需 15 分鐘確認視覺方向，不需動用您太多人力。<br><br>您可以從這邊參考我們的服務及作品集：https://playplus.com.tw/<br><br>感謝您,謝謝廣德昌，祝條蔘文化持續繁榮,您好，<br><br>這是我最後一次主動寫信給您。沒收到您的回覆，我想數位改版或許不是您目前的重點計畫。我會停止追蹤，以免打擾您的工作。<br><br>由衷敬佩廣德昌在人蔘文化的耕耘，未來若有任何數位形象提升的需求，歡迎隨時與 PlayPlus 聯繫。<br><br>祝 貴司生意興隆，文化長青。<br><br>您可以從這邊參考我們的服務及作品集：https://playplus.com.tw/<br><br>感謝您
