公司品牌簡稱,序號,官方網站,產業,員工人數,email,聯絡人名稱,來源,說明,Unnamed: 9,Day 1,Day 7,Day 14,Day 30,Day 60,day1_title,day1_content,day7_title,day7_content,day14_title,day14_content,day30_title,day30_content,day60_title,day60_content
夏馬城市生活,20260429,http://www.shiamal.com,批發,10-29人,info@shiamal.com ,官方,https://www.104.com.tw/company/1a2x6bjpc0,源自台中的頂級居家選物品牌，代理全球20多國經典設計家飾與家具。秉持一站式購物服務理念，由專業管家提供風格建議與空間規劃，涵蓋沙發、餐廚到花藝包裝，致力將世界各地的幸福美學帶入台灣家庭，打造理想的生活層次。,,2026/4/29,2026/5/6,2026/5/13,2026/5/29,2026/6/28,關於夏馬城市生活的品牌體驗優化建議,您好，<br><br>最近瀏覽了夏馬城市生活的官網，非常欣賞你們代理全球 20 多國設計家飾的眼光，整體的「一站式購物」理念也很吸引人。不過我也注意到，目前網站的視覺配置與購物動線，似乎還能更精準地傳遞你們那種「頂級、幸福美學」的品牌精神，特別是在行動裝置上的導覽流暢度。<br><br>我們是 PlayPlus，專注於協助居家選物與高端品牌將網站轉化為「能說故事」且高轉換率的數位平台。我們曾協助不少品牌在不變動後端邏輯的情況下，大幅優化前端的使用者體驗，讓客戶在進店的第一秒就感受到品牌的價值。<br><br>是否方便寄一份我們過去在居家與精品產業的優化案例給您參考？您可以從這邊參考我們的服務及作品集：https://playplus.com.tw/<br><br>感謝您,想確認一下這份建議,您好，<br><br>上週有寄了一封關於夏馬城市生活網站體驗優化的簡短建議給您，不知道您是否有機會看過？<br><br>我知道您業務繁忙，若目前暫無規畫，我也完全能理解。只是想確認這封信有沒有順利抵達您的收件匣。<br><br>您可以從這邊參考我們的服務及作品集：https://playplus.com.tw/<br><br>感謝您,居家美學品牌的數位實戰分享,您好，<br><br>接著上封信，我想分享一個我們過去協助類似選物品牌轉型的實戰案例。我們透過重新梳理導航結構與強化視覺張力，讓該品牌的產品點擊率提升了 35% 以上，並顯著縮短了客戶的下單決策路徑。<br><br>對於像夏馬這樣強調風格與質感的品牌，數位的「門面」往往是客戶建立信任的第一步。如果您有興趣了解更多細節，我很樂意分享相關的數據與策略。<br><br>您可以從這邊參考我們的服務及作品集：https://playplus.com.tw/<br><br>感謝您,關於網站優化的預算與時程考量,您好，<br><br>這段時間陸續跟您分享了一些想法，我猜測您可能會擔心網站優化是否會牽動現有系統，或是需要投入大量的溝通成本？<br><br>其實我們提供「模組化開發」方案，您可以針對目前最痛的購物流程優先進行小規模優化，不需要大動干戈。此外，我們的專案管理流程非常精簡，主管每週只需 15 分鐘確認進度即可。<br><br>這或許能讓您在保有預算彈性的同時，也看到轉換率的立即提升。不曉得這是否符合您近期的需求？<br><br>您可以從這邊參考我們的服務及作品集：https://playplus.com.tw/<br><br>感謝您,最後的告別與未來期待,您好，<br><br>這是我最後一封主動追蹤的郵件。這段時間沒收到您的回覆，我想數位轉型或許不是您目前的優先事項。我會停止主動聯繫，以免打擾您的工作。<br><br>不過，若未來您有考慮優化夏馬的數位體驗，或是想提升線上轉換率，我們隨時都歡迎您回頭聊聊。PlayPlus 會持續在居家美學數位化的領域深耕。<br><br>祝 貴司業務蒸蒸日上。<br><br>您可以從這邊參考我們的服務及作品集：https://playplus.com.tw/<br><br>感謝您
宸路,20260429,https://www.naturepower.life/,批發,10-29人,naturepower.info@gmail.com,官方,https://www.104.com.tw/company/1a2x6blrhy,專業品牌代理與進口商，經營超過120個歐美知名品牌，涵蓋美妝保養、時尚穿搭及生活小物。擁有強大的電商與實體通路，結合美式管理風格與年輕活力的團隊，致力於為供應商與客戶實現雙贏，提供台灣市場更優質且具價格競爭力的選擇。,,2026/4/29,2026/5/6,2026/5/13,2026/5/29,2026/6/28,宸路 120+ 品牌的數位通路成長建議,您好，<br><br>注意到宸路代理了超過 120 個歐美品牌，且橫跨美妝、時尚等多個領域，團隊的運作規模令人敬佩。不過，管理如此龐大的產品線，在官網上的產品檢索與導購動線往往是最大的挑戰，這直接影響了客戶的轉化與停留時間。<br><br>我們是 PlayPlus，專注於協助代理商優化數位通路的使用者體驗。我們擅長將複雜的產品線重新架構，讓使用者能直覺地找到所需的品牌，進而提升客單價。<br><br>是否方便寄一份我們過去在多品牌代理商方面的優化案例給您參考？您可以從這邊參考我們的服務及作品集：https://playplus.com.tw/<br><br>感謝您,一個小提醒：宸路的數位優化建議,您好，<br><br>上週我分享了關於宸路 120 多個品牌在數位通路上的優化想法，不知您是否有空閱覽？<br><br>如果您正忙於新品牌的引進，我完全能理解。若有興趣進一步了解我們如何簡化複雜的導購流程，隨時歡迎回信。<br><br>您可以從這邊參考我們的服務及作品集：https://playplus.com.tw/<br><br>感謝您,多品牌電商的轉換率提升案例,您好，<br><br>我想補充一個案例。我們曾協助一家經營多品類的電商，透過引入智慧篩選系統與優化商品詳情頁，讓其移動端轉換率提升了 28%。<br><br>對於宸路這樣擁有多品牌優勢的公司，極簡且高效的 UI/UX 設計能大幅降低使用者的認知負擔，轉化為實質的業績成長。期待有機會能跟您分享更多實戰細節。<br><br>您可以從這邊參考我們的服務及專業案例：https://playplus.com.tw/<br><br>感謝您,關於大規模優化的執行疑慮,您好，<br><br>這段時間沒收到您的回音，我猜測您可能在評估，如果要優化這麼多品牌的呈現，是否會導致網站停機或過長的開發週期？<br><br>事實上，我們採用分階段優化策略，可以在不影響現有營運的情況下，逐步更新核心頁面。我們也了解代理商通常需要快速應對市場，因此我們的協作模式非常靈活，能大幅減少內部溝通的隱形成本。<br><br>您可以從這邊參考我們的服務及作品集：https://playplus.com.tw/<br><br>感謝您,謝謝宸路，期待未來有緣合作,您好，<br><br>這是我的最後一封追蹤信。沒收到回音，想必您目前已有穩定的數位策略，我會將您的聯絡資訊移出主動聯繫名單，不再打擾您的業務。<br><br>很高興這段時間能關注宸路的成長，若未來有任何網站改版或使用者體驗設計的需求，隨時歡迎與我們聯繫。祝 貴司生意興隆！<br><br>您可以從這邊參考我們的服務及作品集：https://playplus.com.tw/<br><br>感謝您
普利衛浴器材,20260429,http://www.ponyfaucet.com,批發,10-29人,pony@ponyfaucet.com,官方,https://www.104.com.tw/company/b0eivjc,創立於1991年的績優進出口廠商，專精於衛浴器材的研發、生產與批發。旗下品牌「PSW」行銷全球三十年，產品涵蓋水龍頭、不鏽鋼軟管及五金工具。公司秉持品質第一與研發創新的經營理念，致力於提供客戶滿意的卓越解決方案。,,2026/4/29,2026/5/6,2026/5/13,2026/5/29,2026/6/28,關於 PSW 品牌全球化數位體驗建議,您好，<br><br>普利衛浴在衛浴器材領域深耕 30 多年，PSW 品牌的全球行銷成就令人印象深刻。不過，我也觀察到目前的品牌官網在呈現「研發創新」與「卓越方案」這兩大核心理念上，似乎還有進一步提升的空間，這對於爭取國際新客戶的信任感尤為關鍵。<br><br>我們是 PlayPlus，專注於協助績優製造商打造具備國際視野的數位門面。我們能協助您將技術實力轉化為直觀、專業的數位語言，提升品牌在海外市場的競爭力。<br><br>是否方便寄一份我們過去在製造與外銷產業的優化案例給您參考？您可以從這邊參考我們的服務及作品集：https://playplus.com.tw/<br><br>感謝您,關於 PSW 網站優化的簡短確認,您好，<br><br>上週曾致信分享關於普利衛浴網站優化的一些觀察，不曉得您是否看過？<br><br>若您正忙於國際展覽或業務開發，我完全能理解。如果您對如何透過數位介面強化品牌專業度有興趣，隨時歡迎簡短回覆。<br><br>您可以從這邊參考我們的服務及作品集：https://playplus.com.tw/<br><br>感謝您,製造業轉型數位門面的成功案例,您好，<br><br>接著上封信，我想分享一個案例。我們曾協助一家外銷導向的五金製造商重新梳理其官網結構，將技術手冊與產品展示數位化。改版後，該公司的海外詢盤率增加了約 40%。<br><br>對 PSW 這樣擁有 30 年底蘊的品牌，高品質的數位體驗是建立國際信任最快速的方式。如果您想了解更多針對製造業的優化策略，我很樂意與您分享。<br><br>您可以從這邊參考我們的服務及作品集：https://playplus.com.tw/<br><br>感謝您,網站改版是否會耗費過多資源？,您好，<br><br>這段時間陸續跟您分享了一些想法，我猜測您可能會擔心網站改版會需要大量的時間與研發人力投入？<br><br>其實 PlayPlus 提供一站式的設計與前端開發方案，主管每週只需 15 分鐘確認視覺方向，不需動用您的研發團隊。我們也提供分階段優化方案，讓您可以根據年度預算彈性調整進度。<br><br>您可以從這邊參考我們的服務及作品集：https://playplus.com.tw/<br><br>感謝您,珍重再見，祝 PSW 品牌持續發光,您好，<br><br>這是我最後一次主動寫信給您。沒收到您的回覆，我想數位改版或許不是您今年的重點計畫。我會停止追蹤，以免打擾您的工作。<br><br>由衷敬佩普利衛浴在衛浴產業的堅持，未來若有任何數位轉型或網站更新的需求，隨時歡迎再與 PlayPlus 聯繫。<br><br>祝 貴司外銷捷報頻傳。<br><br>您可以從這邊參考我們的服務及作品集：https://playplus.com.tw/<br><br>感謝您
安翊,20260429,http://www.goodland.com.tw,批發,10-29人,sales@goodland.com.tw,官方,https://www.104.com.tw/company/13m8sle8,台灣領先的建築與石材保養材料專家，擁有逾20年的研發與工程經驗。公司深耕環保建材領域，推廣專利滴水條、生態透水地坪及環保鋁模板等資源利用產品。致力於環境美化工程，以降低地球負荷為宗旨，為國內外建築市場提供專業且永續的解決方案。,,2026/4/29,2026/5/6,2026/5/13,2026/5/29,2026/6/28,安翊在環保建材領域的數位形象優化,您好，<br><br>最近研究了安翊在石材保養與環保建材領域的專業成就，深感敬佩。不過，作為建築與石材保養專家，我也注意到目前網站在呈現「專業工程經驗」與「環保解決方案」時，視覺流暢度與行動端體驗還有不少進步空間。<br><br>我們是 PlayPlus，專注於協助技術領先的企業將專業力轉化為高品質的數位語言。我們能協助您將複雜的工程案例與專利產品，以更具吸引力的方式呈現給設計師與開發商。<br><br>是否方便寄一份我們過去在建材與工程產業的優化案例給您參考？您可以從這邊參考我們的服務及作品集：https://playplus.com.tw/<br><br>感謝您,想確認關於安翊網站的建議,您好，<br><br>上週有分享一些關於安翊網站在環保建材形象呈現上的優化想法，不知您是否有空撥冗閱覽？<br><br>如果您最近正忙於大型工程專案，我完全能理解。若您對如何透過數位平台提升轉化率有興趣，隨時歡迎回信。<br><br>您可以從這邊參考我們的服務及作品集：https://playplus.com.tw/<br><br>感謝您,建材產業的數位信任轉化案例,您好，<br><br>我想分享一個案例。我們曾協助一家環保材料供應商優化其產品展示頁面，透過更清晰的數據視覺化與案例分享，讓該品牌的專業度在數位平台上得到大幅提升，進而帶動了 30% 的諮詢成長。<br><br>對安翊來說，網站不只是資訊展示，更是與建築師建立初步信任的關鍵。期待有機會與您分享更多實戰案例。<br><br>您可以從這邊參考我們的服務及作品集：https://playplus.com.tw/<br><br>感謝您,網站優化的執行彈性與疑慮,您好，<br><br>這段時間沒收到您的回音，我猜測您可能在考量預算分配或是擔心改版過程過於複雜？<br><br>PlayPlus 提供靈活的「分階段優化方案」，您可以針對特定的工程案例區塊或重點產品線先行優化，逐步提升整體形象。我們的協作模式非常輕量，主管每週僅需 15 分鐘確認進度，不會增加您的工作負擔。<br><br>您可以從這邊參考我們的服務及作品集：https://playplus.com.tw/<br><br>感謝您,感謝安翊，未來有緣再會,您好，<br><br>這是我的最後一封追蹤信。由於未收到您的回覆，我會先將您的資料移出聯繫名單，以免造成困擾。<br><br>由衷敬佩安翊在環保建材上的努力，若未來有任何數位轉型或網站改版需求，PlayPlus 隨時歡迎您的諮詢。<br><br>祝 貴司案量滾滾，事業順心。<br><br>您可以從這邊參考我們的服務及作品集：https://playplus.com.tw/<br><br>感謝您
安翊,20260429,http://www.goodland.com.tw,批發,10-29人,goodland@ms10.hinet.net,官方,https://www.104.com.tw/company/13m8sle8,台灣領先的建築與石材保養材料專家，擁有逾20年的研發與工程經驗。公司深耕環保建材領域，推廣專利滴水條、生態透水地坪及環保鋁模板等資源利用產品。致力於環境美化工程，以降低地球負荷為宗旨，為國內外建築市場提供專業且永續的解決方案。,,2026/4/29,2026/5/6,2026/5/13,2026/5/29,2026/6/28,安翊在環保建材領域的數位形象優化,您好，<br><br>最近研究了安翊在石材保養與環保建材領域的專業成就，深感敬佩。不過，作為建築與石材保養專家，我也注意到目前網站在呈現「專業工程經驗」與「環保解決方案」時，視覺流暢度與行動端體驗還有不少進步空間。<br><br>我們是 PlayPlus，專注於協助技術領先的企業將專業力轉化為高品質的數位語言。我們能協助您將複雜的工程案例與專利產品，以更具吸引力的方式呈現給設計師與開發商。<br><br>是否方便寄一份我們過去在建材與工程產業的優化案例給您參考？您可以從這邊參考我們的服務及作品集：https://playplus.com.tw/<br><br>感謝您,想確認關於安翊網站的建議,您好，<br><br>上週有分享一些關於安翊網站在環保建材形象呈現上的優化想法，不知您是否有空撥冗閱覽？<br><br>如果您最近正忙於大型工程專案，我完全能理解。若您對如何透過數位平台提升轉化率有興趣，隨時歡迎回信。<br><br>您可以從這邊參考我們的服務及作品集：https://playplus.com.tw/<br><br>感謝您,建材產業的數位信任轉化案例,您好，<br><br>我想分享一個案例。我們曾協助一家環保材料供應商優化其產品展示頁面，透過更清晰的數據視覺化與案例分享，讓該品牌的專業度在數位平台上得到大幅提升，進而帶動了 30% 的諮詢成長。<br><br>對安翊來說，網站不只是資訊展示，更是與建築師建立初步信任的關鍵。期待有機會與您分享更多實戰案例。<br><br>您可以從這邊參考我們的服務及作品集：https://playplus.com.tw/<br><br>感謝您,網站優化的執行彈性與疑慮,您好，<br><br>這段時間沒收到您的回音，我猜測您可能在考量預算分配或是擔心改版過程過於複雜？<br><br>PlayPlus 提供靈活的「分階段優化方案」，您可以針對特定的工程案例區塊或重點產品線先行優化，逐步提升整體形象。我們的協作模式非常輕量，主管每週僅需 15 分鐘確認進度，不會增加您的工作負擔。<br><br>您可以從這邊參考我們的服務及作品集：https://playplus.com.tw/<br><br>感謝您,感謝安翊，未來有緣再會,您好，<br><br>這是我的最後一封追蹤信。由於未收到您的回覆，我會先將您的資料移出聯繫名單，以免造成困擾。<br><br>由衷敬佩安翊在環保建材上的努力，若未來有任何數位轉型或網站改版需求，PlayPlus 隨時歡迎您的諮詢。<br><br>祝 貴司案量滾滾，事業順心。<br><br>您可以從這邊參考我們的服務及作品集：https://playplus.com.tw/<br><br>感謝您
茂德,20260429,http://www.parco.com.tw,批發,10-29人,info@parco.com.tw,官方,https://www.104.com.tw/company/18rw2p14,創立於1997年的技術導向型設備出口商，專精於金屬加工設備整廠規劃、塗裝設備與機器人系統整合。市場橫跨亞、歐、非多國，擁有優秀的跨國研發與經營團隊。秉持事在人為的精神，致力於提供客戶高品質的自動化生產方案，追求企業永續成長。,,2026/4/29,2026/5/6,2026/5/13,2026/5/29,2026/6/28,茂德自動化系統的數位展示優化建議,您好，<br><br>茂德在金屬加工與機器人系統整合領域的專業實力令人印象深刻，特別是跨國市場的佈局。不過，我觀察到目前的官網在呈現「整廠規劃」與「高精度自動化」這些核心技術時，視覺動線與行動端的適配性似乎還有優化空間，這對於爭取歐美高端客戶的信任感非常重要。<br><br>我們是 PlayPlus，專注於協助技術導向型企業打造具備國際競爭力的數位形象。我們擅長將複雜的工業流程轉化為簡約、專業的互動介面。<br><br>是否方便寄一份我們過去在工業自動化產業的 UI/UX 優化案例給您參考？您可以從這邊參考我們的服務及作品集：https://playplus.com.tw/<br><br>感謝您,關於茂德網站優化的一個小提醒,您好，<br><br>上週有分享一些關於茂德網站在技術形象呈現上的建議，不知道您是否看過？<br><br>若您正忙於跨國專案，我完全能理解。如果您對如何透過數位優化提升詢盤率有興趣，隨時歡迎簡短回覆。<br><br>您可以從這邊參考我們的服務及作品集：https://playplus.com.tw/<br><br>感謝您,技術密集型產業的數位轉化實戰,您好，<br><br>我想分享一個案例。我們曾協助一家自動化設備商優化其產品展示區，透過直觀的 3D 渲染圖配置與結構化的技術文檔展示，讓其海外客戶的詢問精準度提升了 50% 以上。<br><br>對茂德來說，高品質的數位門面能直接縮短與國際買家的溝通成本。期待能與您分享更多實戰經驗。<br><br>您可以從這邊參考我們的服務及作品集：https://playplus.com.tw/<br><br>感謝您,關於系統整合企業的優化考量,您好，<br><br>這段時間沒收到您的回音，我猜測您可能在考量網站改版是否會影響現有的技術文檔或後端數據？<br><br>PlayPlus 擅長「非侵入式」的前端優化，可以在不改動您現有邏輯的情況下，大幅提升視覺感受。我們也了解製造業的需求，溝通流程非常精簡有效率。<br><br>您可以從這邊參考我們的服務及作品集：https://playplus.com.tw/<br><br>感謝您,謝謝茂德，期待未來合作,您好，<br><br>這是我的最後一封追蹤信。沒收到回音，想必您目前已有穩定的數位策略，我會將您的聯絡資訊移出主動聯繫名單，不再打擾您的業務。<br><br>由衷佩服茂德在自動化領域的深耕，若未來有任何網站更新需求，PlayPlus 隨時歡迎您的諮詢。<br><br>祝 貴司業務蒸蒸日上。<br><br>您可以從這邊參考我們的服務及作品集：https://playplus.com.tw/<br><br>感謝您
美綠裝飾,20260429,http://www.beautygreen.com.tw/,批發,10-29人,service@beautygreen.com.tw,官方,https://www.104.com.tw/company/1a2x6bk5xo,成立於1996年，是集研發、生產、銷售於一體的室內外裝飾材料供應商。與美國NextStone合作，採用輕量化高分子原料打造具設計感的牆面裝飾板。公司積極響應綠能政策，推動可重複使用的環保建材，為設計界提供高品質且永續的多元選擇。,,2026/4/29,2026/5/6,2026/5/13,2026/5/29,2026/6/28,美綠裝飾：讓建材在數位世界更具質感,您好，<br><br>最近研究了美綠裝飾在輕量化高分子裝飾板（NextStone）的專業成就，您們對環保與設計的結合非常出色。不過我也發現，作為設計導向的材料商，目前的網站視覺配置與產品展示方式，似乎還能更細緻地展現建材的真實質感與層次。<br><br>我們是 PlayPlus，專注於協助美學與建材品牌將實體質感轉化為高品質的數位體驗。我們能協助您打造讓設計師一眼就想採用的數位樣板書。<br><br>是否方便寄一份我們過去在美學與建材產業的優化案例給您參考？您可以從這邊參考我們的服務及作品集：https://playplus.com.tw/<br><br>感謝您,想確認關於美綠裝飾網站的建議,您好，<br><br>上週分享了關於美綠網站在數位視覺呈現上的優化想法，不曉得您是否看過？<br><br>如果您最近正忙於新產品發布，我完全能理解。若您對如何提升網站在設計師圈的吸引力有興趣，隨時歡迎回信。<br><br>您可以從這邊參考我們的服務及作品集：https://playplus.com.tw/<br><br>感謝您,設計師導向品牌的數位轉化實戰,您好，<br><br>我想分享一個案例。我們曾協助一家高端裝飾品牌重新設計產品篩選與展示邏輯，讓設計師能更快速找到對應風格，這帶動了 35% 的樣本索取率。<br><br>對美綠來說，網站就是最好的展示間。如果您有興趣了解更多針對設計產業的優化策略，我很樂意與您分享。<br><br>您可以從這邊參考我們的服務及作品集：https://playplus.com.tw/<br><br>感謝您,關於數位樣板書的執行疑慮,您好，<br><br>這段時間陸續跟您分享了一些想法，我猜測您可能會擔心高品質的視覺呈現會導致網站載入過慢？<br><br>PlayPlus 擁有頂尖的前端優化技術，能確保在呈現高清細節的同時，保有極速的瀏覽體驗。我們也提供分階段優化，讓您可以根據行銷預算彈性調整進度。<br><br>您可以從這邊參考我們的服務及作品集：https://playplus.com.tw/<br><br>感謝您,最後的告別，祝美綠生意興隆,您好，<br><br>這是我最後一封主動追蹤的郵件。沒收到回覆，我想數位改版或許不是您目前的優先事項。我會停止追蹤，以免打擾您的工作。<br><br>很高興這段時間能關注美綠的環保建材，若未來有任何數位體驗優化的需求，歡迎隨時與我們聯繫。<br><br>祝 貴司案量不斷，事業順心。<br><br>您可以從這邊參考我們的服務及作品集：https://playplus.com.tw/<br><br>感謝您
