公司品牌簡稱,序號,官方網站,產業,員工人數,email,聯絡人名稱,來源,說明,Unnamed: 9,Day 1,Day 7,Day 14,Day 30,Day 60,day1_title,day1_content,day7_title,day7_content,day14_title,day14_content,day30_title,day30_content,day60_title,day60_content
瀚陽國際,20260429,https://www.han-phoebus.com/index.php?lang=tw,批發,10-29人,hansun.ltd@msa.hinet.net,官方,https://www.104.com.tw/company/cqogsmw,成立於2003年，深耕電子產業、半導體及晶圓封測領域，為專業無塵室耗材與特殊光源供應商。代理韓國WOOJIN KM等國際品牌，並具備無塵擦拭布與抗靜電產品的自主研發製造能力。產品廣泛應用於輝達AI供應鏈等尖端產業，致力於提升客戶製程良率與降低成本。,,2026/4/29,2026/5/6,2026/5/13,2026/5/29,2026/6/28,瀚陽國際：關於 AI 供應鏈夥伴的數位形象建議,您好，<br><br>瀚陽國際深耕半導體與封測領域多年，能成為輝達（NVIDIA）AI 供應鏈的一環，技術實力確實令人驚嘆。不過我也觀察到，作為高科技產業的核心夥伴，目前的官網在呈現「高規格無塵室技術」與「自主研發能力」時，視覺質感與行動端體驗似乎還有提升空間。<br><br>我們是 PlayPlus，專注於協助尖端科技供應商打造具備國際視野的數位門面。我們能協助您將技術數據與製程優勢，以更俐落、更具科技感的數位語言呈現。<br><br>是否方便寄一份我們過去在半導體與電子產業的優化案例給您參考？您可以從這邊參考我們的服務及作品集：https://playplus.com.tw/<br><br>感謝您,關於瀚陽國際網站優化的一個小提醒,您好，<br><br>上週曾致信分享關於瀚陽網站在數位形象呈現上的觀察，不曉得您是否看過？<br><br>若您正忙於供應鏈調度或新產品開發，我完全能理解。如果您對如何透過數位優化強化國際大廠的信任感有興趣，隨時歡迎簡短回覆。<br><br>您可以從這邊參考我們的服務及作品集：https://playplus.com.tw/<br><br>感謝您,高科技供應鏈的數位轉化實戰,您好，<br><br>我想分享一個案例。我們曾協助一個電子耗材商優化其數位技術展示，讓其在面對國際級採購時，能更直觀地展現品質穩定性。這不僅縮短了溝通成本，更顯著提升了新客戶的初步信任感。<br><br>對於瀚陽這樣身處 AI 尖端產業的公司，高品質的數位門面是您技術力的最好證明。期待能與您分享更多實戰細節。<br><br>您可以從這邊參考我們的服務及作品集：https://playplus.com.tw/<br><br>感謝您,網站優化的執行考量與彈性,您好，<br><br>這段時間陸續跟您分享了一些想法，我猜測您可能會擔心網站優化需要投入過多的人力資源，或影響現有的技術對接流程？<br><br>其實 PlayPlus 提供「輕量化」的協作方案，主管每週只需 15 分鐘確認進度，不需動用您的核心團隊。我們也提供分階段方案，讓您可以根據年度推廣計畫靈活調整預算。<br><br>您可以從這邊參考我們的服務及作品集：https://playplus.com.tw/<br><br>感謝您,謝謝瀚陽國際，祝 AI 業務持續領航,您好，<br><br>這是我的最後一次主動寫信給您。沒收到您的回覆，我想數位改版或許不是您今年的重點計畫。我會停止追蹤，以免打擾您的工作。<br><br>由衷敬佩瀚陽國際在半導體產業的耕耘，未來若有任何數位轉型或網站更新需求，歡迎隨時與 PlayPlus 聯繫。<br><br>祝 貴司生意興隆，持續輝煌。<br><br>您可以從這邊參考我們的服務及作品集：https://playplus.com.tw/<br><br>感謝您
九十度小港,20260429,http://90system.com,批發,10-29人,xg90system@gmail.com,官方,https://www.104.com.tw/company/1a2x6bixb6,擁有直營工廠的櫥櫃廚具品牌，專精於系統家具、廚具、衣櫃及室內裝修設計。公司強調設計創新與實用性，每道工序皆嚴格把關，確保產品堅固耐用且價格實惠。九十度廚櫃致力於為客戶打造兼具美感與功能性的居家空間，以專業的工廠直營優勢提供高品質的家具服務。,,2026/4/29,2026/5/6,2026/5/13,2026/5/29,2026/6/28,九十度廚櫃：讓居家美學在數位世界更具吸引力,您好，<br><br>最近研究了九十度廚櫃在系統家具與櫥櫃設計上的成果，直營工廠的品質與實惠價格非常有競爭力。不過我也發現，作為居家美學的推手，目前的官網在呈現「精緻質感」與「設計創新」時，視覺張力與行動端操作流暢度似乎還有提升空間。<br><br>我們是 PlayPlus，專注於協助居家與設計品牌打造具備高品質視覺與流暢體驗的數位平台。我們能協助您將九十度廚櫃的設計細節，以更具吸引力的方式展現給追求生活質感的客戶。<br><br>是否方便寄一份我們過去在居家與設計產業的優化案例給您參考？您可以從這邊參考我們的服務及作品集：https://playplus.com.tw/<br><br>感謝您,想確認關於九十度廚櫃網站的建議,您好，<br><br>上週分享了一些關於九十度網站在數位視覺呈現上的優化想法，不知您是否有空撥冗閱覽？<br><br>如果您最近正忙於新案件的工期，我完全能理解。若您對如何透過 UI/UX 提升轉化率有興趣，隨時歡迎回信。<br><br>您可以從這邊參考我們的服務及作品集：https://playplus.com.tw/<br><br>感謝您,居家產業的數位轉化實戰分享,您好，<br><br>我想補充一個案例。我們曾協助一個櫥櫃品牌重新設計其案例展示頁面，透過強調「實體場景」與優化操作邏輯，讓其預約諮詢率提升了 30% 以上。<br><br>對於九十度廚櫃來說，高品質的網站就是您最好的「虛擬樣品屋」。期待有機會與您分享更多實戰細節。<br><br>您可以從這邊參考我們的服務及作品集：https://playplus.com.tw/<br><br>感謝您,數位形象升級的執行疑慮與彈性,您好，<br><br>這段時間沒收到您的回音，我猜測您可能在考量網站優化是否會影響現有的客戶諮詢流程？<br><br>PlayPlus 擅長輕量化的優化，我們可以在不改動現有流程的前提下，逐步提升視覺張力。我們的主管協作模式非常靈活，主管每週僅需 15 分鐘確認進度即可。<br><br>您可以從這邊參考我們的服務及作品集：https://playplus.com.tw/<br><br>感謝您,謝謝九十度，祝居家美學推廣順利,您好，<br><br>這是我的最後一封追蹤信。沒收到回覆，我想數位改版或許不是您目前的優先事項。我會停止追蹤，以免打擾您的工作。<br><br>由衷敬佩九十度廚櫃在家具產業的耕耘，未來若有任何網站更新或數位體驗優化需求，PlayPlus 隨時歡迎諮詢。<br><br>祝 貴司案量不斷，事業順心。<br><br>您可以從這邊參考我們的服務及作品集：https://playplus.com.tw/<br><br>感謝您
合德興業,20260429,https://www.highstart.com.tw,批發,10-29人,hs5938626@gmail.com,官方,https://www.104.com.tw/company/10v4wn54,創立於2002年的專業潤滑油銷售商，團隊擁有十年以上專業經驗。專營愛司達（AESTAR）機油、工業潤滑油及各類切削油，服務對象涵蓋全台汽車保養廠與各式工廠。秉持客戶第一的理念，合德興業透過完整的技術訓練與穩定的供應鏈，致力於追求企業的永續經營與成長。,,2026/4/29,2026/5/6,2026/5/13,2026/5/29,2026/6/28,合德興業：關於愛司達機油品牌的數位形象建議,您好，<br><br>合德興業在潤滑油領域擁有超過 10 年的專業經驗，服務全台保養廠的實力令人佩服。不過我也注意到，作為專業油品供應商，目前的官網在呈現「專業技術訓練」與「穩定供應鏈」時，視覺配置與導覽流暢度似乎還有優化空間。<br><br>我們是 PlayPlus，專注於協助技術服務商打造具備高信任感的數位平台。我們能協助您將專業的油品知識與服務實力，以更清晰、現代的方式呈現給保養廠主。<br><br>是否方便寄一份我們過去在工業與服務產業的優化案例給您參考？您可以從這邊參考我們的服務及作品集：https://playplus.com.tw/<br><br>感謝您,關於合德興業網站優化的一個小提醒,您好，<br><br>上週曾致信分享關於合德網站在數位形象呈現上的觀察，不曉得您是否看過？<br><br>若您正忙於全台業務開發，我完全能理解。如果您對如何透過數位優化強化專業品牌形象有興趣，隨時歡迎簡短回覆。<br><br>您可以從這邊參考我們的服務及作品集：https://playplus.com.tw/<br><br>感謝您,服務導向產業的數位信任案例,您好，<br><br>我想分享一個案例。我們曾協助一家油品經銷商優化其技術支援頁面，透過更清晰的產品說明與案例分析，讓該品牌的專業度在數位平台上得到大幅提升，並增加了新客戶的詢問率。<br><br>對合德興業來說，高品質的數位門面是您「專業經驗」的最好載體。期待能與您分享更多實戰細節。<br><br>您可以從這邊參考我們的服務及作品集：https://playplus.com.tw/<br><br>感謝您,網站優化的執行考量與彈性,您好，<br><br>這段時間陸續跟您分享了一些想法，我猜測您可能會擔心網站優化需要投入大量人力，或影響現有的客戶溝通流程？<br><br>PlayPlus 提供「低負擔」的協作方案，主管每週只需 15 分鐘確認進度，不需動用您的核心團隊。我們也提供分階段方案，讓您可以根據年度預算靈活調整進度。<br><br>您可以從這邊參考我們的服務及作品集：https://playplus.com.tw/<br><br>感謝您,謝謝合德興業，祝品牌持續穩健成長,您好，<br><br>這是我的最後一次主動寫信給您。沒收到您的回覆，我想數位改版或許不是您目前的優先事項。我會停止追蹤，以免打擾您的工作。<br><br>由衷敬佩合德興業在潤滑油產業的堅持，未來若有任何數位形象提升的需求，歡迎隨時與 PlayPlus 聯繫。<br><br>祝 貴司生意興隆，業績長紅。<br><br>您可以從這邊參考我們的服務及作品集：https://playplus.com.tw/<br><br>感謝您
好萊得綠能,20260429,http://www.allrightgreen.com,批發,10-29人,allright@allrightgreen.com.tw,官方,https://www.104.com.tw/company/1a2x6bke46,成立於2015年，致力於引進歐美日最新趨勢，量身訂製頂級衣帽間與全室櫃體。嚴選PUR防水零甲醛材料與環保科技木紋材，強調健康無毒與精緻質感。透過設計師一對一服務，好萊得將美感、收納與環保功能結合，為追求高品質居家生活的客戶打造專屬的時尚空間。,,2026/4/29,2026/5/6,2026/5/13,2026/5/29,2026/6/28,好萊得綠能：讓頂級衣帽間的「質感」在網上重現,您好，<br><br>好萊得在量身訂製頂級衣帽間與全室櫃體的專業美感令人敬佩，特別是嚴選 PUR 環保材料的精神。不過我也觀察到，作為高端美學空間的打造者，目前的官網視覺配置與行動端體驗似乎還能更精細地傳遞那種「頂級、健康、無毒」的精品氛圍。<br><br>我們是 PlayPlus，專注於協助高端居家品牌打造具備「呼吸感」與「精緻細節」的數位平台。我們能協助您將實體展示間的美感，完美轉化為讓客戶嚮往的數位體驗。<br><br>是否方便寄一份我們過去在精品與居家產業的優化案例給您參考？您可以從這邊參考我們的服務及作品集：https://playplus.com.tw/<br><br>感謝您,想確認關於好萊得網站優化的建議,您好，<br><br>上週分享了關於好萊得網站在精品空間視覺呈現上的優化想法，不知您是否有空撥冗閱覽？<br><br>如果您最近正忙於設計案的交付，我完全能理解。若您對如何透過 UI/UX 提升高端客戶的轉化率有興趣，隨時歡迎回信。<br><br>您可以從這邊參考我們的服務及作品集：https://playplus.com.tw/<br><br>感謝您,精品居家品牌的數位轉化實戰,您好，<br><br>我想分享一個案例。我們曾協助一個高端家飾品牌優化其系列展示與設計師對接流程，讓其高端系列的諮詢量提升了 28% 以上。<br><br>對好萊得來說，高品質的網站就是您與高端客戶的第一個溝通過程。期待能與您分享更多實戰細節。<br><br>您可以從這邊參考我們的服務及作品集：https://playplus.com.tw/<br><br>感謝您,數位美學升級的執行疑慮與彈性,您好，<br><br>這段時間沒收到您的回音，我猜測您可能在考量提升視覺品質是否會耗費過多的內部管理成本？<br><br>PlayPlus 提供輕量化的協作模式，主管每週只需 15 分鐘確認進度，不需動用您太多人力。我們也提供分階段方案，讓您可以根據行銷預算靈活調整。<br><br>您可以從這邊參考我們的服務及作品集：https://playplus.com.tw/<br><br>感謝您,謝謝好萊得，祝居家美學推廣順利,您好，<br><br>這是我的最後一封追蹤信。沒收到回覆，我想數位改版或許不是您目前的優先事項。我會停止追蹤，以免打擾您的工作。<br><br>很高興這段時間能關注好萊得在環保美學空間的努力，未來若有任何數位體驗優化的需求，PlayPlus 隨時歡迎您的諮詢。<br><br>祝 貴司案量不斷，事業順心。<br><br>您可以從這邊參考我們的服務及作品集：https://playplus.com.tw/<br><br>感謝您
好萊得綠能,20260429,http://www.allrightgreen.com,批發,10-29人,design@allrightgreen.com.tw,官方,https://www.104.com.tw/company/1a2x6bke46,成立於2015年，致力於引進歐美日最新趨勢，量身訂製頂級衣帽間與全室櫃體。嚴選PUR防水零甲醛材料與環保科技木紋材，強調健康無毒與精緻質感。透過設計師一對一服務，好萊得將美感、收納與環保功能結合，為追求高品質居家生活的客戶打造專屬的時尚空間。,,2026/4/29,2026/5/6,2026/5/13,2026/5/29,2026/6/28,好萊得綠能：讓頂級衣帽間的「質感」在網上重現,您好，<br><br>好萊得在量身訂製頂級衣帽間與全室櫃體的專業美感令人敬佩，特別是嚴選 PUR 環保材料的精神。不過我也觀察到，作為高端美學空間的打造者，目前的官網視覺配置與行動端體驗似乎還能更精細地傳遞那種「頂級、健康、無毒」的精品氛圍。<br><br>我們是 PlayPlus，專注於協助高端居家品牌打造具備「呼吸感」與「精緻細節」的數位平台。我們能協助您將實體展示間的美感，完美轉化為讓客戶嚮往的數位體驗。<br><br>是否方便寄一份我們過去在精品與居家產業的優化案例給您參考？您可以從這邊參考我們的服務及作品集：https://playplus.com.tw/<br><br>感謝您,想確認關於好萊得網站優化的建議,您好，<br><br>上週分享了關於好萊得網站在精品空間視覺呈現上的優化想法，不知您是否有空撥冗閱覽？<br><br>如果您最近正忙於設計案的交付，我完全能理解。若您對如何透過 UI/UX 提升高端客戶的轉化率有興趣，隨時歡迎回信。<br><br>您可以從這邊參考我們的服務及作品集：https://playplus.com.tw/<br><br>感謝您,精品居家品牌的數位轉化實戰,您好，<br><br>我想分享一個案例。我們曾協助一個高端家飾品牌優化其系列展示與設計師對接流程，讓其高端系列的諮詢量提升了 28% 以上。<br><br>對好萊得來說，高品質的網站就是您與高端客戶的第一個溝通過程。期待能與您分享更多實戰細節。<br><br>您可以從這邊參考我們的服務及作品集：https://playplus.com.tw/<br><br>感謝您,數位美學升級的執行疑慮與彈性,您好，<br><br>這段時間沒收到您的回音，我猜測您可能在考量提升視覺品質是否會耗費過多的內部管理成本？<br><br>PlayPlus 提供輕量化的協作模式，主管每週只需 15 分鐘確認視覺方向，不需動用您太多人力。我們也提供分階段方案，讓您可以根據行銷預算靈活調整。<br><br>您可以從這邊參考我們的服務及作品集：https://playplus.com.tw/<br><br>感謝您,謝謝好萊得，祝居家美學推廣順利,您好，<br><br>這是我的最後一封追蹤信。沒收到回覆，我想數位改版或許不是您目前的優先事項。我會停止追蹤，以免打擾您的工作。<br><br>很高興這段時間能關注好萊得在環保美學空間的努力，未來若有任何數位體驗優化的需求，PlayPlus 隨時歡迎您的諮詢。<br><br>祝 貴司案量不斷，事業順心。<br><br>您可以從這邊參考我們的服務及作品集：https://playplus.com.tw/<br><br>感謝您
泰浦樂,20260429,https://www.toppuror.com.tw,批發,10-29人,info@toppuror.com.tw,官方,https://www.104.com.tw/company/1a2x6bjkwk,創立於1993年的淨水設備專家，產品行銷北美、歐洲、中東及大中華地區。專精於RO純水機、各式濾心及配件的研發生產，旗下自有品牌涵蓋隨身到全戶型淨水方案。透過強大的電商通路佈局與全台安裝維修服務網，泰浦樂致力於為全球消費者提供純淨且便利的飲用水環境。,,2026/4/29,2026/5/6,2026/5/13,2026/5/29,2026/6/28,泰浦樂：關於全球化淨水品牌的數位體驗建議,您好，<br><br>泰浦樂在淨水設備領域深耕 30 多年，產品行銷全球多國的成就非常令人敬佩。不過我也觀察到，作為具備強大電商佈局與服務網的專家，目前的官網在呈現「純淨生活方案」與「全台安裝維修服務」時，行動端體驗與導購流暢度似乎還有提升空間。<br><br>我們是 PlayPlus，專注於協助具備國際視野的品牌打造高轉化的數位平台。我們能協助您將技術優勢與售後實力，以更具吸引力且直覺的方式呈現給全球消費者。<br><br>是否方便寄一份我們過去在生活家電與水處理產業的優化案例給您參考？您可以從這邊參考我們的服務及作品集：https://playplus.com.tw/<br><br>感謝您,關於泰浦樂網站優化的一個小提醒,您好，<br><br>上週曾致信分享關於泰浦樂網站在數位形象與導購體驗上的觀察，不曉得您是否看過？<br><br>若您正忙於國際市場拓展或新產品開發，我完全能理解。如果您對如何透過數位優化提升線上諮詢率有興趣，隨時歡迎簡短回覆。<br><br>您可以從這邊參考我們的服務及作品集：https://playplus.com.tw/<br><br>感謝您,生活家電產業的數位轉化實戰,您好，<br><br>我想分享一個案例。我們曾協助一家家電品牌優化其產品系列導覽與服務網查詢功能，讓其使用者的搜尋效率提升了 40%，轉化率也隨之成長了 22%。<br><br>對泰浦樂來說，專業且便捷的數位體驗是建立全球消費者信任的關鍵。期待能與您分享更多實戰細節。<br><br>您可以從這邊參考我們的服務及作品集：https://playplus.com.tw/<br><br>感謝您,網站優化的執行考量與彈性,您好，<br><br>這段時間陸續跟您分享了一些想法，我猜測您可能會擔心網站優化需要投入大量人力，或影響現有的電商對接流程？<br><br>事實上，PlayPlus 提供一站式的設計與前端開發方案，主管每週只需 15 分鐘確認進度，不需動用您的研發團隊。我們也提供分階段方案，讓您可以根據年度行銷預算靈活調整。<br><br>您可以從這邊參考我們的服務及作品集：https://playplus.com.tw/<br><br>感謝您,謝謝泰浦樂，祝純淨生活願景持續推廣,您好，<br><br>這是我的最後一次主動寫信給您。沒收到您的回覆，我想數位改版或許不是您今年的重點計畫。我會停止追蹤，以免打擾您的工作。<br><br>由衷敬佩泰浦樂在淨水產業的專業，未來若有任何數位轉型或網站改版需求，歡迎隨時與 PlayPlus 聯繫。<br><br>祝 貴司生意興隆，業績長紅。<br><br>您可以從這邊參考我們的服務及作品集：https://playplus.com.tw/<br><br>感謝您
