公司品牌簡稱,序號,官方網站,產業,員工人數,email,聯絡人名稱,來源,說明,Unnamed: 9,Day 1,Day 7,Day 14,Day 30,Day 60,day1_title,day1_content,day7_title,day7_content,day14_title,day14_content,day30_title,day30_content,day60_title,day60_content
鋐宇樂器,20260429,http://www.anuenuemusic.com,批發,10-29人,info@anuenuemusic.com,官方,https://www.104.com.tw/company/1a2x6bkxba,創立於2008年的國際知名樂器品牌「aNueNue」，專精於高品質烏克麗麗、吉他及周邊配件的設計與銷售。台北總部扎根台灣，業務遍及日、美、歐等國。秉持勇於創新、嚴於品質的精神，旗下「鳥吉他」系列享譽國際，致力將音樂生活化並帶給世界最好的聲學體驗。,,2026/4/29,2026/5/6,2026/5/13,2026/5/29,2026/6/28,鋐宇樂器 aNueNue：讓「鳥吉他」在數位世界更響亮,您好，<br><br>身為樂器愛好者，一直對 aNueNue 的創新設計與高品質感到驚豔，特別是「鳥吉他」系列。不過，我也注意到作為一個具備國際競爭力的樂器品牌，目前的官網在呈現「極致聲學體驗」與「勇於創新」的精神時，視覺張力與行動端操作流暢度似乎還有進步空間。<br><br>我們是 PlayPlus，專注於協助具備設計感的品牌打造極致的數位體驗。我們能協助您將 aNueNue 的美學轉化為同樣吸睛的互動介面，提升全球樂友的瀏覽體驗。<br><br>是否方便寄一份我們過去在創意與美學品牌方面的優化案例給您參考？您可以從這邊參考我們的服務及作品集：https://playplus.com.tw/<br><br>感謝您,想確認關於 aNueNue 網站的建議,您好，<br><br>上週分享了一些關於 aNueNue 網站在數位美學呈現上的優化想法，不知您是否有空撥冗閱覽？<br><br>如果您最近正忙於新琴款發布或國際展會，我完全能理解。若您對如何透過 UI/UX 提升品牌在全球的數位力有興趣，隨時歡迎回信。<br><br>您可以從這邊參考我們的服務及作品集：https://playplus.com.tw/<br><br>感謝您,美學品牌的數位轉型實戰分享,您好，<br><br>我想補充一個案例。我們曾協助一家具備強烈設計感的休閒品牌優化其產品系列展示方式，讓其國際買家的停留時間增加了 30% 以上。<br><br>對於 aNueNue 這樣注重細節與質感的品牌，高品質的數位互動是建立全球品牌認同最快的方式。期待有機會與您分享更多實戰細節。<br><br>您可以從這邊參考我們的服務及作品集：https://playplus.com.tw/<br><br>感謝您,數位美學升級的執行疑慮,您好，<br><br>這段時間沒收到您的回音，我猜測您可能在考量提升視覺質感是否會增加網站載入負擔？<br><br>PlayPlus 擅長兼顧「美學張力」與「極致性能」，確保在呈現高品質圖像的同時保有最快的反應速度。我們的主管協作模式非常輕量，不會增加您的工作負擔。<br><br>您可以從這邊參考我們的服務及作品集：https://playplus.com.tw/<br><br>感謝您,謝謝 aNueNue，期待未來在音樂與數位交會,您好，<br><br>這是我的最後一封追蹤信。沒收到回音，想必您目前已有穩定的數位策略，我會先將您的聯絡資訊移出聯繫名單。<br><br>由衷敬佩 aNueNue 在吉他工藝上的成就，若未來有任何網站更新或數位體驗優化需求，PlayPlus 隨時歡迎諮詢。<br><br>祝 貴司琴聲傳千里，業務蒸蒸日上。<br><br>您可以從這邊參考我們的服務及作品集：https://playplus.com.tw/<br><br>感謝您
鈞威化工,20260429,http://www.actchem.com.tw,批發,10-29人,phoebe@actchem.com.tw,官方,https://www.104.com.tw/company/a8b47l4,成立於1998年，為專業化學原料批發與進出口貿易商，擁有25年誠信經營經驗。代理Akzo Nobel、Arkema等國際知名化工品牌，業務涵蓋電子、塑膠、建築、食品及醫藥等多元領域。秉持對客戶誠實與對員工信任的原則，鈞威在傳統與高科技化工市場中穩健成長。,,2026/4/29,2026/5/6,2026/5/13,2026/5/29,2026/6/28,關於鈞威化工在化學原料領域的數位轉型建議,您好，<br><br>鈞威化工在化學原料批發領域深耕 25 年，代理 Akzo Nobel 等國際知名品牌的成就是業界有目共睹的。不過我也注意到，作為銜接國際供應鏈的重要橋樑，目前的官網在呈現「誠信經營」與「多元應用領域」時，視覺配置與導覽流暢度似乎還有提升空間。<br><br>我們是 PlayPlus，專注於協助績優貿易商將傳統網站轉化為具備國際專業感的數位門面。我們能協助您將技術規格與產業優勢，以更直覺、現代的方式呈現給高科技客戶。<br><br>是否方便寄一份我們過去在貿易與化工產業的優化案例給您參考？您可以從這邊參考我們的服務及作品集：https://playplus.com.tw/<br><br>感謝您,關於鈞威化工網站優化的一個小提醒,您好，<br><br>上週曾致信分享關於鈞威網站在數位專業形象呈現上的觀察，不曉得您是否看過？<br><br>若您正忙於原料進口或客戶開發，我完全能理解。如果您對如何透過數位優化提升國際商務信任度有興趣，隨時歡迎簡短回覆。<br><br>您可以從這邊參考我們的服務及作品集：https://playplus.com.tw/<br><br>感謝您,貿易產業的數位信任與轉化案例,您好，<br><br>我想分享一個案例。我們曾協助一家化學原料代理商重新梳理其產品目錄與應用場景的展示方式，讓其潛在客戶的諮詢精準度提升了 30% 以上。<br><br>對於鈞威這樣擁有 25 年底蘊的公司，高品質的數位門面是鞏固客戶信任最有效的方式。期待能與您分享更多實戰細節。<br><br>您可以從這邊參考我們的服務及作品集：https://playplus.com.tw/<br><br>感謝您,網站優化的執行彈性與疑慮,您好，<br><br>這段時間沒收到您的回音，我猜測您可能在考量網站優化是否會需要大量的人力資源或研發投入？<br><br>PlayPlus 提供一站式的設計與前端開發方案，主管每週只需 15 分鐘確認進度，不需動用您的核心團隊。我們也提供分階段方案，讓您可以根據年度行銷計畫靈活調整預算。<br><br>您可以從這邊參考我們的服務及作品集：https://playplus.com.tw/<br><br>感謝您,謝謝鈞威化工，祝業務持續穩健成長,您好，<br><br>這是我的最後一封追蹤信。由於未收到您的回覆，我會先將您的資料移出聯繫名單，以免造成困擾。<br><br>由衷敬佩鈞威化工在化工領域的誠信經營，若未來有任何數位轉型或網站更新的需求，隨時歡迎再與 PlayPlus 聯繫。<br><br>祝 貴司生意興隆，業績長紅。<br><br>您可以從這邊參考我們的服務及作品集：https://playplus.com.tw/<br><br>感謝您
巨發,20260429,https://www.eptqfillertw.com/,批發,10-29人,julian055080@gmail.com,官方,https://www.104.com.tw/company/1a2x6bmxf6,韓國醫美大廠JETEMA在台獨家經銷商，專注於推廣e.p.t.q.蜂巢玻尿酸、鈍針及拉提線材等高品質醫美產品。公司透過扁平化新創文化，快速佈局整形外科與皮膚科診所，致力於引進全球先進技術，為台灣專業醫師與消費者提供高品質的醫學美容解決方案。,,2026/4/29,2026/5/6,2026/5/13,2026/5/29,2026/6/28,關於巨發（EPTQ）在醫美領域的數位形象建議,您好，<br><br>注意到巨發作為 JETEMA 在台獨家經銷商，致力於推廣 e.p.t.q. 蜂巢玻尿酸等高品質產品，團隊的新創文化非常有活力。不過我也觀察到，在追求美感的醫美產業中，目前的官網視覺配置與行動端體驗似乎還能更細緻地體現「極致工藝」與「美學高度」。<br><br>我們是 PlayPlus，專注於協助醫美與生技品牌將產品的「美」轉化為高品質的數位互動體驗。我們能協助您打造一個讓專業醫師一眼就感受到品牌高度的數位展示平台。<br><br>是否方便寄一份我們過去在醫美與美學產業的優化案例給您參考？您可以從這邊參考我們的服務及作品集：https://playplus.com.tw/<br><br>感謝您,想確認關於巨發網站優化的建議,您好，<br><br>上週分享了關於巨發網站在醫美專業與美學呈現上的優化想法，不曉得您是否看過？<br><br>如果您最近正忙於診所佈局或技術研討會，我完全能理解。若您對如何透過 UI/UX 提升品牌的數位力有興趣，隨時歡迎回信。<br><br>您可以從這邊參考我們的服務及作品集：https://playplus.com.tw/<br><br>感謝您,醫美產業的數位視覺轉化案例,您好，<br><br>我想分享一個案例。我們曾協助一個醫美品牌重新打造其數位展示區，透過強調「極致細節」與優化視覺流暢度，讓該品牌的專業度在數位平台上得到大幅提升，並帶動了 25% 的診所詢問成長。<br><br>對於巨發來說，網站就是您最好的「美感名片」。期待有機會與您分享更多實戰細節。<br><br>您可以從這邊參考我們的服務及作品集：https://playplus.com.tw/<br><br>感謝您,數位美學升級的執行疑慮,您好，<br><br>這段時間沒收到您的回音，我猜測您可能在考量提升視覺質感是否會增加網站的開發週期或成本？<br><br>PlayPlus 擅長「模組化優化」，我們可以在不改動您後端邏輯的前提下，逐步提升核心頁面的視覺感受。我們的主管協作模式非常輕量，主管每週僅需 15 分鐘確認進度。<br><br>您可以從這邊參考我們的服務及作品集：https://playplus.com.tw/<br><br>感謝您,謝謝巨發，祝品牌在美業發光,您好，<br><br>這是我最後一封主動追蹤的郵件。沒收到回覆，我想數位改版或許不是您目前的優先事項。我會停止追蹤，以免打擾您的工作。<br><br>很高興這段時間能關注巨發在醫美領域的佈局，若未來有任何數位體驗優化的需求，歡迎隨時聯繫。<br><br>祝 貴司業績長紅，萬事如意。<br><br>您可以從這邊參考我們的服務及作品集：https://playplus.com.tw/<br><br>感謝您
恩豐,20260429,https://www.efplastic.com.tw/#items,批發,10-29人,everfore@efplastic.com.tw,官方,https://www.104.com.tw/company/ah6yzzs,擁有38年經驗的塑膠與化妝品包材專家，成功從台塑塑料經銷商轉型為國際化妝品包材領導者。服務對象包含NARS、L’Oréal及Gucci等上千個全球品牌。專注於創新環保材質與一站式包材設計，憑藉精益求精的品質與細緻服務，致力於打造美妝產業的永續未來。,,2026/4/29,2026/5/6,2026/5/13,2026/5/29,2026/6/28,恩豐 38 年包材專業：讓數位形象與 NARS/Gucci 同級,您好，<br><br>恩豐在化妝品包材領域深耕 38 年，能獲得 NARS、Gucci 等全球品牌信任，實力令人敬佩。不過我也觀察到，作為美妝產業鏈的高端合作夥伴，目前的官網在呈現「創新環保材質」與「一站式包材設計」時，視覺細膩度似乎還有提升空間，這對於吸引更多國際品牌主尤為關鍵。<br><br>我們是 PlayPlus，專注於協助高端製造商打造具備國際設計水準的數位門面。我們能協助您將包材的質感與永續理念，以同樣精緻的數位語言呈現。<br><br>是否方便寄一份我們過去在精品與美妝產業的優化案例給您參考？您可以從這邊參考我們的服務及作品集：https://playplus.com.tw/<br><br>感謝您,關於恩豐網站優化的一個小提醒,您好，<br><br>上週有分享一些關於恩豐網站在包材專業呈現上的優化想法，不知您是否有空撥冗閱覽？<br><br>如果您最近正忙於國際展會或新材質研發，我完全能理解。若您對如何透過數位優化提升品牌競爭力有興趣，隨時歡迎回信。<br><br>您可以從這邊參考我們的服務及作品集：https://playplus.com.tw/<br><br>感謝您,精品供應鏈的數位轉化實戰分享,您好，<br><br>我想補充一個案例。我們曾協助一家高端零件商優化其視覺包裝與導覽動線，讓該品牌在爭取國際訂單時的數位印象分大幅提升，進而帶動了海外詢問率成長 35%。<br><br>對於恩豐這樣追求精益求精的公司，高品質的網站是展現「設計與品質」的第一道門檻。期待能與您分享更多細節。<br><br>您可以從這邊參考我們的服務及作品集：https://playplus.com.tw/<br><br>感謝您,數位形象升級的執行疑慮與彈性,您好，<br><br>這段時間沒收到您的回音，我猜測您可能在考量網站優化是否會需要大量的內部管理成本？<br><br>PlayPlus 採用輕量化的協作模式，主管每週只需 15 分鐘確認視覺方向，不需動用您太多人力。我們也提供分階段方案，讓您可以根據年度行銷預算靈活調整。<br><br>您可以從這邊參考我們的服務及作品集：https://playplus.com.tw/<br><br>感謝您,謝謝恩豐，祝包材美學持續領航,您好，<br><br>這是我的最後一封追蹤信。沒收到回覆，我想數位改版或許不是您今年的重點計畫。我會停止追蹤，以免打擾您的工作。<br><br>由衷敬佩恩豐在包材產業的深厚基礎，未來若有任何數位體驗優化的需求，PlayPlus 隨時歡迎您的諮詢。<br><br>祝 貴司業務蒸蒸日上，案量不斷。<br><br>您可以從這邊參考我們的服務及作品集：https://playplus.com.tw/<br><br>感謝您
興和氣體,20260429,http://www.xhgas.com.tw/,批發,10-29人,taichung@xhgas.com.tw,官方,https://www.104.com.tw/company/1a2x6bibdn,成立逾40年，從高壓氣體鋼瓶經銷轉型為多元化氣體銷售與服務的集團化企業。業務涵蓋工業、電子及特殊混合氣體的分裝與銷售，並提供液態氨運輸及化學品物流方案。透過全台分工佈局與專業管理，興和氣體致力於為工業與電子產業提供穩定且安全的氣體供應。,,2026/4/29,2026/5/6,2026/5/13,2026/5/29,2026/6/28,興和氣體：關於集團化經營的數位形象建議,您好，<br><br>興和氣體成立逾 40 年，從鋼瓶經銷到多元氣體服務的集團化轉型非常成功。不過我也注意到，作為工業與電子產業的關鍵供應夥伴，目前的官網在呈現「專業管理」與「穩定安全供應」這些核心承諾時，視覺配置與行動端體驗似乎還有優化空間。<br><br>我們是 PlayPlus，專注於協助績優企業打造具備「信任感」與「高效率」的數位形象。我們能協助您將複雜的服務流程數位化，提升品牌在大型企業客戶心中的可靠度。<br><br>是否方便寄一份我們過去在工業與能源產業的優化案例給您參考？您可以從這邊參考我們的服務及作品集：https://playplus.com.tw/<br><br>感謝您,關於興和氣體網站優化的一個小提醒,您好，<br><br>上週曾致信分享關於興和氣體網站在數位專業形象呈現上的觀察，不曉得您是否看過？<br><br>若您正忙於全台佈局或特殊氣體業務，我完全能理解。如果您對如何透過數位優化強化品牌穩定度有興趣，隨時歡迎簡短回覆。<br><br>您可以從這邊參考我們的服務及作品集：https://playplus.com.tw/<br><br>感謝您,工業服務產業的數位信任案例,您好，<br><br>我想分享一個案例。我們曾協助一家化學物流商優化其官網，將其安全標準與運送流程數位化。改版後，該公司在面對大型科技客戶的採購評選時，數位印象分顯著提升，轉化率也提升了約 20%。<br><br>對興和氣體來說，專業的數位形象是建立長期大型客戶信任的基石。期待能與您分享更多實戰細節。<br><br>您可以從這邊參考我們的服務及作品集：https://playplus.com.tw/<br><br>感謝您,網站優化的執行考量與彈性,您好，<br><br>這段時間陸續跟您分享了一些想法，我猜測您可能會擔心網站優化需要投入大量人力，或影響現有的溝通流程？<br><br>其實 PlayPlus 提供「低負擔」的協作方案，主管每週只需 15 分鐘確認進度，不需動用您的核心團隊。我們也提供分階段方案，讓您可以根據年度推廣預算靈活調整進度。<br><br>您可以從這邊參考我們的服務及作品集：https://playplus.com.tw/<br><br>感謝您,謝謝興和氣體，祝產業供氣持續穩定,您好，<br><br>這是我最後一次主動寫信給您。沒收到您的回覆，我想數位改版或許不是您目前的優先事項。我會停止追蹤，以免打擾您的工作。<br><br>由衷敬佩興和氣體在氣體產業的深耕，未來若有任何數位轉型或網站更新需求，歡迎隨時與 PlayPlus 聯繫。<br><br>祝 貴司生意興隆，事業順心。<br><br>您可以從這邊參考我們的服務及作品集：https://playplus.com.tw/<br><br>感謝您
睿瀚,20260429,https://rehan-tech.com/,批發,10-29人,sales@rhtech-pcb.com,官方,https://www.104.com.tw/company/1a2x6bl1h1,專精於高品質、高技術規格印刷電路板（PCB）服務的科技公司。提供從Layout設計、PCB製造、SMT表面貼件到組測包裝的一站式完整服務。睿瀚以卓越品質與專業服務為根基，積極配合客戶優化供應鏈，在競爭激烈的電子研發環境中，致力於成為客戶的首選合作夥伴。,,2026/4/29,2026/5/6,2026/5/13,2026/5/29,2026/6/28,睿瀚科技：讓 PCB 一站式服務更具數位競爭力,您好，<br><br>注意到睿瀚在高品質 PCB 服務（從 Layout 到 SMT）的一站式整合，這在競爭激烈的電子研發環境中極具優勢。不過我也觀察到，目前的官網在呈現「高技術規格」與「專業一站式服務」時，視覺流暢度與專業呈現感似乎還有優化空間。<br><br>我們是 PlayPlus，專注於協助高科技製造與服務業打造「極致俐落」的數位形象。我們能協助您將繁雜的技術細節轉化為更具現代感且易於理解的互動介面，爭取更多高端開發團隊的信任。<br><br>是否方便寄一份我們過去在電子與硬體產業的優化案例給您參考？您可以從這邊參考我們的服務及作品集：https://playplus.com.tw/<br><br>感謝您,關於睿瀚科技網站優化的一個小提醒,您好，<br><br>上週曾致信分享關於睿瀚網站在數位形象呈現上的建議，不知您是否有空撥冗閱覽？<br><br>若您正忙於協助客戶趕進度，我完全能理解。若您對如何透過數位介面強化品牌專業度有興趣，隨時歡迎回信。<br><br>您可以從這邊參考我們的服務及作品集：https://playplus.com.tw/<br><br>感謝您,高科技產業的數位轉化實戰,您好，<br><br>我想分享一個案例。我們曾協助一個電子零件商優化其官網，將原本生硬的產品手冊轉化為動態、互動式的技術展示，這讓其新客戶的詢盤率增加了 45% 以上。<br><br>對睿瀚來說，專業的數位形象是展現「技術力」最快的方式。期待能與您分享更多實戰細節。<br><br>您可以從這邊參考我們的服務及作品集：https://playplus.com.tw/<br><br>感謝您,關於數位優化的執行彈性,您好，<br><br>這段時間沒收到您的回音，我猜測您可能在評估網站改版是否會耗費過多的內部溝通成本？<br><br>PlayPlus 採用輕量化的協作模式，主管每週只需 15 分鐘確認進度，不需動用您的研發人力。我們也提供分階段方案，讓您可以根據年度行銷計畫靈活調整預算。<br><br>您可以從這邊參考我們的服務及作品集：https://playplus.com.tw/<br><br>感謝您,謝謝睿瀚科技，祝 PCB 業務大展宏圖,您好，<br><br>這是我的最後一封追蹤信。沒收到回覆，我想數位改版或許不是您目前的重點計畫。我會停止追蹤，以免打擾您的工作。<br><br>由衷敬佩睿瀚在 PCB 領域的專業，未來若有任何數位轉型需求，PlayPlus 隨時歡迎您的諮詢。<br><br>祝 貴司生意興隆，持續領航。<br><br>您可以從這邊參考我們的服務及作品集：https://playplus.com.tw/<br><br>感謝您
瀚陽國際,20260429,https://www.han-phoebus.com/index.php?lang=tw,批發,10-29人,hansunltd@mail.han-sun.com.tw,官方,https://www.104.com.tw/company/cqogsmw,成立於2003年，深耕電子產業、半導體及晶圓封測領域，為專業無塵室耗材與特殊光源供應商。代理韓國WOOJIN KM等國際品牌，並具備無塵擦拭布與抗靜電產品的自主研發製造能力。產品廣泛應用於輝達AI供應鏈等尖端產業，致力於提升客戶製程良率與降低成本。,,2026/4/29,2026/5/6,2026/5/13,2026/5/29,2026/6/28,瀚陽國際：關於 AI 供應鏈夥伴的數位形象建議,您好，<br><br>瀚陽國際深耕半導體與封測領域多年，能成為輝達（NVIDIA）AI 供應鏈的一環，技術實力確實令人驚嘆。不過我也觀察到，作為高科技產業的核心夥伴，目前的官網在呈現「高規格無塵室技術」與「自主研發能力」時，視覺質感與行動端體驗似乎還有提升空間。<br><br>我們是 PlayPlus，專注於協助尖端科技供應商打造具備國際視野的數位門面。我們能協助您將技術數據與製程優勢，以更俐落、更具科技感的數位語言呈現。<br><br>是否方便寄一份我們過去在半導體與電子產業的優化案例給您參考？您可以從這邊參考我們的服務及作品集：https://playplus.com.tw/<br><br>感謝您,關於瀚陽國際網站優化的一個小提醒,您好，<br><br>上週曾致信分享關於瀚陽網站在數位形象呈現上的觀察，不曉得您是否看過？<br><br>若您正忙於供應鏈調度或新產品開發，我完全能理解。如果您對如何透過數位優化強化國際大廠的信任感有興趣，隨時歡迎簡短回覆。<br><br>您可以從這邊參考我們的服務及作品集：https://playplus.com.tw/<br><br>感謝您,高科技供應鏈的數位轉化實戰,您好，<br><br>我想分享一個案例。我們曾協助一個電子耗材商優化其數位技術展示，讓其在面對國際級採購時，能更直觀地展現品質穩定性。這不僅縮短了溝通成本，更顯著提升了新客戶的初步信任感。<br><br>對於瀚陽這樣身處 AI 尖端產業的公司，高品質的數位門面是您技術力的最好證明。期待能與您分享更多實戰細節。<br><br>您可以從這邊參考我們的服務及作品集：https://playplus.com.tw/<br><br>感謝您,網站優化的執行考量與彈性,您好，<br><br>這段時間陸續跟您分享了一些想法，我猜測您可能會擔心網站優化需要投入過多的人力資源，或影響現有的技術對接流程？<br><br>其實 PlayPlus 提供「輕量化」的協作方案，主管每週只需 15 分鐘確認進度，不需動用您的核心團隊。我們也提供分階段方案，讓您可以根據年度推廣計畫靈活調整預算。<br><br>您可以從這邊參考我們的服務及作品集：https://playplus.com.tw/<br><br>感謝您,謝謝瀚陽國際，祝 AI 業務持續領航,您好，<br><br>這是我的最後一次主動寫信給您。沒收到您的回覆，我想數位改版或許不是您今年的重點計畫。我會停止追蹤，以免打擾您的工作。<br><br>由衷敬佩瀚陽國際在半導體產業的耕耘，未來若有任何數位轉型或網站更新需求，歡迎隨時與 PlayPlus 聯繫。<br><br>祝 貴司生意興隆，持續輝煌。<br><br>您可以從這邊參考我們的服務及作品集：https://playplus.com.tw/<br><br>感謝您
